{
  "$schema": "https://json-schema.org/draft/2020-12/schema",
  "$id": "https://us-alpha-seeker.local/schemas/stage6_sidecar_entry_fillability_contract.schema.json",
  "title": "Stage6 Sidecar Entry Fillability Contract",
  "type": "object",
  "required": ["schema_version", "generated_at", "candidates"],
  "properties": {
    "schema_version": { "type": "string" },
    "generated_at": { "type": "string" },
    "decisionGate": {
      "type": "object",
      "properties": {
        "currentEntryMinRr": { "type": "number", "exclusiveMinimum": 0 },
        "currentEntryMaxAdaptiveDistancePct": { "type": "number", "minimum": 0 },
        "currentEntryMinTargetBufferPct": { "type": "number", "minimum": 0 },
        "zeroExecutableFormulaContract": {
          "type": "object",
          "properties": {
            "version": { "type": "string" },
            "requiredRowFields": { "type": "array", "items": { "type": "string" } },
            "laneToBottleneck": { "type": "object", "additionalProperties": { "type": "string" } },
            "evidenceRules": { "type": "object", "additionalProperties": { "type": "string" } }
          },
          "additionalProperties": true
        }
      },
      "additionalProperties": true
    },
    "candidates": {
      "type": "array",
      "items": { "$ref": "#/$defs/stage6Candidate" }
    }
  },
  "additionalProperties": true,
  "$defs": {
    "nullableNumber": {
      "anyOf": [
        { "type": "number" },
        { "type": "null" }
      ]
    },
    "nullableString": {
      "anyOf": [
        { "type": "string" },
        { "type": "null" }
      ]
    },
    "nullableBoolean": {
      "anyOf": [
        { "type": "boolean" },
        { "type": "null" }
      ]
    },
    "nullableStringArray": {
      "anyOf": [
        { "type": "array", "items": { "type": "string" } },
        { "type": "null" }
      ]
    },
    "stage6Candidate": {
      "type": "object",
      "required": [
        "symbol",
        "finalDecision",
        "decisionReason",
        "executionFeasibilityAtCurrent"
      ],
      "properties": {
        "symbol": { "type": "string", "minLength": 1 },
        "finalDecision": {
          "type": "string",
          "enum": ["EXECUTABLE_NOW", "WAIT_PRICE", "BLOCKED_RISK", "BLOCKED_EVENT"]
        },
        "decisionReason": { "type": "string", "minLength": 1 },
        "entryExecPrice": { "$ref": "#/$defs/nullableNumber" },
        "entryExecPriceShadow": { "$ref": "#/$defs/nullableNumber" },
        "targetPrice": { "$ref": "#/$defs/nullableNumber" },
        "targetMeanPrice": { "$ref": "#/$defs/nullableNumber" },
        "price": { "$ref": "#/$defs/nullableNumber" },
        "stopPrice": { "$ref": "#/$defs/nullableNumber" },
        "stopLoss": { "$ref": "#/$defs/nullableNumber" },
        "ictStopLoss": { "$ref": "#/$defs/nullableNumber" },
        "executionActionableVerdict": { "$ref": "#/$defs/nullableBoolean" },
        "rrAtCurrentPrice": { "$ref": "#/$defs/nullableNumber" },
        "entryDistancePct": { "$ref": "#/$defs/nullableNumber" },
        "entryDistancePctShadow": { "$ref": "#/$defs/nullableNumber" },
        "targetBufferFromCurrentPct": { "$ref": "#/$defs/nullableNumber" },
        "executionFeasibilityAtCurrent": {
          "type": "string",
          "enum": ["PASS", "BLOCKED", "UNKNOWN"]
        },
        "executionFeasibilityAtCurrentVerdict": { "$ref": "#/$defs/nullableString" },
        "executionFeasibilityAtCurrentReason": { "$ref": "#/$defs/nullableString" },
        "executionFeasibilityAtCurrentReasons": {
          "anyOf": [
            { "type": "array", "items": { "type": "string" } },
            { "type": "null" }
          ]
        },
        "executionFeasibilityAtCurrentRr": { "$ref": "#/$defs/nullableNumber" },
        "executionFeasibilityAtCurrentDistancePct": { "$ref": "#/$defs/nullableNumber" },
        "executionFeasibilityAtCurrentMinRr": { "$ref": "#/$defs/nullableNumber" },
        "executionFeasibilityAtCurrentMaxDistancePct": { "$ref": "#/$defs/nullableNumber" },
        "executionFeasibilityAtCurrentMinTargetBufferPct": { "$ref": "#/$defs/nullableNumber" },
        "executionFeasibilityAtCurrentBasis": { "$ref": "#/$defs/nullableString" },
        "chosenPlanType": { "$ref": "#/$defs/nullableString" },
        "currentEntryRecalcFeasible": { "$ref": "#/$defs/nullableBoolean" },
        "currentEntryStructureConfirmed": { "$ref": "#/$defs/nullableBoolean" },
        "currentEntryRequiredStopPrice": { "$ref": "#/$defs/nullableNumber" },
        "currentEntryRequiredStopDistancePct": { "$ref": "#/$defs/nullableNumber" },
        "weakPillarGateWaiver": { "$ref": "#/$defs/nullableBoolean" },
        "weakPillarGateVerdict": { "$ref": "#/$defs/nullableString" },
        "weakPillarGateReasons": { "$ref": "#/$defs/nullableStringArray" },
        "breakoutRetestProofTolerancePct": { "$ref": "#/$defs/nullableNumber" },
        "breakoutRetestProofMaxBarsSinceRetest": { "$ref": "#/$defs/nullableNumber" },
        "breakoutRetestProofMaxExtensionPct": { "$ref": "#/$defs/nullableNumber" },
        "breakoutRetestProofConfirmed": { "$ref": "#/$defs/nullableBoolean" },
        "breakoutRetestProofReviewReady": { "$ref": "#/$defs/nullableBoolean" },
        "breakoutRetestProofRetestTouchFound": { "$ref": "#/$defs/nullableBoolean" },
        "breakoutRetestProofRetestFresh": { "$ref": "#/$defs/nullableBoolean" },
        "breakoutRetestProofCurrentExtensionOk": { "$ref": "#/$defs/nullableBoolean" },
        "breakoutRetestProofLatestCloseAboveRetest": { "$ref": "#/$defs/nullableBoolean" },
        "breakoutRetestProofRetestClose": { "$ref": "#/$defs/nullableNumber" },
        "breakoutRetestProofRetestLowGapPct": { "$ref": "#/$defs/nullableNumber" },
        "breakoutRetestProofRetestCloseGapPct": { "$ref": "#/$defs/nullableNumber" },
        "breakoutRetestProofRetestCloseReclaimed": { "$ref": "#/$defs/nullableBoolean" },
        "breakoutRetestProofContinuationConfirmed": { "$ref": "#/$defs/nullableBoolean" },
        "breakoutRetestProofContinuationExtensionOk": { "$ref": "#/$defs/nullableBoolean" },
        "breakoutRetestProofFormulaEvidenceBasis": { "$ref": "#/$defs/nullableString" },
        "breakoutRetestProofFormulaObservedValue": { "$ref": "#/$defs/nullableNumber" },
        "breakoutRetestProofFormulaThresholdValue": { "$ref": "#/$defs/nullableNumber" },
        "breakoutRetestProofFormulaDeltaValue": { "$ref": "#/$defs/nullableNumber" },
        "breakoutRetestProofFormulaUnit": { "$ref": "#/$defs/nullableString" },
        "breakoutRetestPromotionReady": { "$ref": "#/$defs/nullableBoolean" },
        "breakoutRetestPromotionEligible": { "$ref": "#/$defs/nullableBoolean" },
        "breakoutRetestPromotionEnabled": { "$ref": "#/$defs/nullableBoolean" },
        "breakoutRetestPromotionVerdict": { "$ref": "#/$defs/nullableString" },
        "breakoutRetestPromotionEntryBasis": { "$ref": "#/$defs/nullableString" },
        "breakoutRetestPromotionPolicyDecision": { "$ref": "#/$defs/nullableString" },
        "breakoutRetestPromotionBlockedBy": { "$ref": "#/$defs/nullableStringArray" },
        "currentEntryStructureSupportReference": { "$ref": "#/$defs/nullableString" },
        "currentEntryStructureSupportGapAtr": { "$ref": "#/$defs/nullableNumber" },
        "currentEntryStructureNearestSupportLow": { "$ref": "#/$defs/nullableNumber" },
        "currentEntryStructureNearestSupportGapAtr": { "$ref": "#/$defs/nullableNumber" },
        "currentEntryStructureStopAlignedSupportLow": { "$ref": "#/$defs/nullableNumber" },
        "currentEntryStructureStopAlignedSupportGapAtr": { "$ref": "#/$defs/nullableNumber" },
        "structurePolicyBlockerLane": { "$ref": "#/$defs/nullableString" },
        "structurePolicyCurrentRrOk": { "$ref": "#/$defs/nullableBoolean" },
        "structurePolicyCurrentRrValue": { "$ref": "#/$defs/nullableNumber" },
        "structurePolicyMinRr": { "$ref": "#/$defs/nullableNumber" },
        "structurePolicyCurrentRrShortfall": { "$ref": "#/$defs/nullableNumber" },
        "structurePolicyTargetBufferOk": { "$ref": "#/$defs/nullableBoolean" },
        "structurePolicyTargetBufferPct": { "$ref": "#/$defs/nullableNumber" },
        "structurePolicyMinTargetBufferPct": { "$ref": "#/$defs/nullableNumber" },
        "structurePolicyTargetBufferShortfallPct": { "$ref": "#/$defs/nullableNumber" },
        "structurePolicyDistanceWithinReviewBand": { "$ref": "#/$defs/nullableBoolean" },
        "structurePolicyEntryDistancePct": { "$ref": "#/$defs/nullableNumber" },
        "structurePolicyMaxReviewDistancePct": { "$ref": "#/$defs/nullableNumber" },
        "structurePolicyDistanceExcessPct": { "$ref": "#/$defs/nullableNumber" },
        "structurePolicyFormulaEvidenceBasis": { "$ref": "#/$defs/nullableString" },
        "structurePolicyReviewReady": { "$ref": "#/$defs/nullableBoolean" },
        "structurePolicyVerdict": { "$ref": "#/$defs/nullableString" },
        "currentEntryStructureVerdict": { "$ref": "#/$defs/nullableString" },
        "targetRecalibrationRequired": { "$ref": "#/$defs/nullableBoolean" },
        "targetNoChaseRequired": { "$ref": "#/$defs/nullableBoolean" },
        "targetRecalibrationCurrentTargetPrice": { "$ref": "#/$defs/nullableNumber" },
        "targetRecalibrationRequiredTargetPrice": { "$ref": "#/$defs/nullableNumber" },
        "targetRecalibrationRequiredTargetByBufferPrice": { "$ref": "#/$defs/nullableNumber" },
        "targetRecalibrationRequiredTargetByRrPrice": { "$ref": "#/$defs/nullableNumber" },
        "targetRecalibrationRequiredTargetByExpectedReturnPrice": { "$ref": "#/$defs/nullableNumber" },
        "targetRecalibrationRequiredTargetBufferPct": { "$ref": "#/$defs/nullableNumber" },
        "targetRecalibrationRequiredRr": { "$ref": "#/$defs/nullableNumber" },
        "targetRecalibrationCurrentTargetGapPct": { "$ref": "#/$defs/nullableNumber" },
        "targetRecalibrationSourcePrice": { "$ref": "#/$defs/nullableNumber" },
        "targetRecalibrationSourceStopPrice": { "$ref": "#/$defs/nullableNumber" },
        "targetRecalibrationStopDistanceAtCurrent": { "$ref": "#/$defs/nullableNumber" },
        "targetRecalibrationRequiredTargetSource": { "$ref": "#/$defs/nullableString" },
        "targetRecalibrationCandidate": { "$ref": "#/$defs/nullableBoolean" },
        "targetNoTradeConfirmed": { "$ref": "#/$defs/nullableBoolean" },
        "targetRecalibrationVerdict": { "$ref": "#/$defs/nullableString" },
        "targetRecalibrationViabilityVerdict": { "$ref": "#/$defs/nullableString" },
        "targetRecalibrationViabilityReasons": { "$ref": "#/$defs/nullableStringArray" },
        "targetRecalibrationGapPolicyPct": { "$ref": "#/$defs/nullableNumber" },
        "riskGeometryPolicyVerdict": { "$ref": "#/$defs/nullableString" },
        "riskGeometryRecalibrationRequired": { "$ref": "#/$defs/nullableBoolean" },
        "riskGeometryNoTradeRequired": { "$ref": "#/$defs/nullableBoolean" },
        "riskGeometryRecalculatedStopCandidate": { "$ref": "#/$defs/nullableBoolean" },
        "riskGeometryProofVerdict": { "$ref": "#/$defs/nullableString" },
        "riskGeometryRecalculatedStopPrice": { "$ref": "#/$defs/nullableNumber" },
        "riskGeometryRecalculatedStopDistancePct": { "$ref": "#/$defs/nullableNumber" },
        "riskGeometryRrAtRecalculatedStop": { "$ref": "#/$defs/nullableNumber" },
        "riskGeometryRequiredTargetPrice": { "$ref": "#/$defs/nullableNumber" },
        "riskGeometryRequiredTargetByStopPrice": { "$ref": "#/$defs/nullableNumber" },
        "riskGeometryRequiredTargetByBufferPrice": { "$ref": "#/$defs/nullableNumber" },
        "riskGeometryRequiredTargetByExpectedReturnPrice": { "$ref": "#/$defs/nullableNumber" },
        "riskGeometryRequiredTargetSource": { "$ref": "#/$defs/nullableString" },
        "riskGeometryRequiredTargetBufferPct": { "$ref": "#/$defs/nullableNumber" },
        "riskGeometryTargetGapPct": { "$ref": "#/$defs/nullableNumber" },
        "riskGeometryTargetShortfallPct": { "$ref": "#/$defs/nullableNumber" },
        "riskGeometryTargetRecalibrationCandidate": { "$ref": "#/$defs/nullableBoolean" },
        "riskGeometryTargetRecalibrationGapPolicyPct": { "$ref": "#/$defs/nullableNumber" },
        "riskGeometryTargetNoTradeConfirmed": { "$ref": "#/$defs/nullableBoolean" },
        "riskGeometryTargetBufferPct": { "$ref": "#/$defs/nullableNumber" },
        "riskGeometryTargetAboveCurrent": { "$ref": "#/$defs/nullableBoolean" },
        "riskGeometryRequiredStopValid": { "$ref": "#/$defs/nullableBoolean" },
        "riskGeometryRequiredStopDistanceValid": { "$ref": "#/$defs/nullableBoolean" },
        "riskGeometryRecalculatedStopRrOk": { "$ref": "#/$defs/nullableBoolean" },
        "riskGeometryTargetBufferOk": { "$ref": "#/$defs/nullableBoolean" },
        "riskGeometryRepairLane": { "$ref": "#/$defs/nullableString" },
        "riskGeometryProofConfirmed": { "$ref": "#/$defs/nullableBoolean" },
        "riskGeometryProofReasons": { "$ref": "#/$defs/nullableStringArray" },
        "zeroExecutableTuningLane": { "$ref": "#/$defs/nullableString" },
        "zeroExecutableTuningVerdict": { "$ref": "#/$defs/nullableString" },
        "zeroExecutablePrimaryTuningTarget": { "$ref": "#/$defs/nullableBoolean" },
        "zeroExecutableFormulaBottleneck": { "$ref": "#/$defs/nullableString" },
        "zeroExecutableFormulaSeverity": { "$ref": "#/$defs/nullableNumber" },
        "zeroExecutableTargetShortfallPct": { "$ref": "#/$defs/nullableNumber" },
        "zeroExecutableRiskTargetShortfallPct": { "$ref": "#/$defs/nullableNumber" },
        "zeroExecutableBreakoutProofGapCount": { "$ref": "#/$defs/nullableNumber" },
        "zeroExecutableStructureProofGapCount": { "$ref": "#/$defs/nullableNumber" },
        "zeroExecutableFormulaObservedValue": { "$ref": "#/$defs/nullableNumber" },
        "zeroExecutableFormulaThresholdValue": { "$ref": "#/$defs/nullableNumber" },
        "zeroExecutableFormulaDeltaValue": { "$ref": "#/$defs/nullableNumber" },
        "zeroExecutableFormulaUnit": { "$ref": "#/$defs/nullableString" },
        "zeroExecutableFormulaEvidenceBasis": { "$ref": "#/$defs/nullableString" },
        "zeroExecutableFormulaAdjustmentKnob": { "$ref": "#/$defs/nullableString" },
        "zeroExecutableFormulaAdjustmentDirection": { "$ref": "#/$defs/nullableString" },
        "zeroExecutableFormulaAdjustmentMagnitude": { "$ref": "#/$defs/nullableNumber" },
        "zeroExecutableFormulaAdjustmentRationale": { "$ref": "#/$defs/nullableString" },
        "zeroExecutableFormulaReasons": { "$ref": "#/$defs/nullableStringArray" },
        "zeroExecutableFormulaRecommendedAction": { "$ref": "#/$defs/nullableString" },
        "qualityGateLane": { "$ref": "#/$defs/nullableString" },
        "qualityGatePolicyVerdict": { "$ref": "#/$defs/nullableString" },
        "qualityGateReasons": { "$ref": "#/$defs/nullableStringArray" },
        "qualityGateRecommendedAction": { "$ref": "#/$defs/nullableString" }
      },
      "additionalProperties": true
    }
  }
}
