{
  "schema_version": "1.0.0",
  "generated_at": "2026-06-04T00:00:00.000Z",
  "decisionGate": {
    "currentEntryMinRr": 1.8,
    "currentEntryMaxAdaptiveDistancePct": 6,
    "currentEntryMinTargetBufferPct": 3,
    "actionableVerdicts": "BUY,STRONG_BUY,STRONGBUY",
    "speculativeBuyExecutableWaiver": false,
    "breakoutRetestProofPromotionEnabled": false,
    "breakoutRetestProofPromotionRule": "proofConfirmed_and_current_rr_target_buffer_required; reviewReady_never_promotes",
    "adaptiveCurrentEntryRule": "WAIT_PULLBACK_TOO_DEEP cannot promote without recalculated-stop structure proof or confirmed breakout retest proof",
    "targetGeometryRule": "target/current geometry requires Stage6 recalibration or NO_TRADE; sidecar reprice must not chase target-near-current cases",
    "zeroExecutableTuningPriority": [
      "TARGET_RECALIBRATION",
      "STOP_TARGET_RISK_GEOMETRY_RECALCULATION",
      "BREAKOUT_PROOF_CONFIRMED_GENERATION"
    ],
    "zeroExecutableStructureRule": "structure waits require stronger producer proof; do not relax structure gates as the default zero-executable response",
    "targetRecalibrationPolicy": {
      "maxRequiredTargetGapPct": 20
    },
    "weakPillarGateEnabled": true,
    "weakPillarExecutableWaiver": false,
    "weakPillarMinFundamentalScore": 50,
    "weakPillarMinTechnicalScore": 50,
    "weakPillarMinIctScore": 60,
    "zeroExecutableFormulaContract": {
      "version": "zero_executable_formula_v4",
      "requiredRowFields": [
        "zeroExecutableFormulaBottleneck",
        "zeroExecutableFormulaSeverity",
        "zeroExecutableTargetShortfallPct",
        "zeroExecutableRiskTargetShortfallPct",
        "zeroExecutableBreakoutProofGapCount",
        "zeroExecutableStructureProofGapCount",
        "zeroExecutableFormulaObservedValue",
        "zeroExecutableFormulaThresholdValue",
        "zeroExecutableFormulaDeltaValue",
        "zeroExecutableFormulaUnit",
        "zeroExecutableFormulaEvidenceBasis",
        "zeroExecutableFormulaAdjustmentKnob",
        "zeroExecutableFormulaAdjustmentDirection",
        "zeroExecutableFormulaAdjustmentMagnitude",
        "zeroExecutableFormulaAdjustmentRationale",
        "zeroExecutableFormulaReasons",
        "zeroExecutableFormulaRecommendedAction"
      ],
      "laneToBottleneck": {
        "TARGET_RECALIBRATION": "TARGET_RECALIBRATION_FORMULA",
        "STOP_TARGET_RISK_GEOMETRY_RECALCULATION": "RISK_GEOMETRY_RECALCULATION_FORMULA",
        "RISK_GEOMETRY_NO_TRADE_OR_RECALIBRATION": "RISK_GEOMETRY_RECALCULATION_FORMULA",
        "BREAKOUT_PROOF_CONFIRMED_GENERATION": "BREAKOUT_PROOF_FORMULA",
        "STRUCTURE_PROOF_REQUIRED_NOT_RELAXATION": "STRUCTURE_PROOF_FORMULA",
        "NO_ZERO_EXECUTABLE_TUNING_ACTION": "NO_ZERO_EXECUTABLE_FORMULA_BOTTLENECK"
      },
      "evidenceRules": {
        "TARGET_RECALIBRATION": "zeroExecutableTargetShortfallPct and formula observed/delta values must be positive; adjustment must name target recalibration knob",
        "STOP_TARGET_RISK_GEOMETRY_RECALCULATION": "zeroExecutableFormulaSeverity and formula observed/delta values must be positive and reasons must name risk/stop/target geometry evidence; adjustment must name risk geometry knob",
        "RISK_GEOMETRY_NO_TRADE_OR_RECALIBRATION": "zeroExecutableFormulaSeverity and formula observed/delta values must be positive and reasons must name risk/stop/target geometry evidence; adjustment must name risk geometry knob",
        "BREAKOUT_PROOF_CONFIRMED_GENERATION": "zeroExecutableBreakoutProofGapCount and formula observed/delta values must be positive; adjustment must name breakout proof knob",
        "STRUCTURE_PROOF_REQUIRED_NOT_RELAXATION": "zeroExecutableStructureProofGapCount plus structure formula observed/delta values must be positive; adjustment must name structure proof knob",
        "NO_ZERO_EXECUTABLE_TUNING_ACTION": "neutral bottleneck, zero severity, zero observed/delta, no positive formula gaps, and no adjustment knob"
      },
      "laneSpecificRowFields": {
        "TARGET_RECALIBRATION": [
          "targetRecalibrationFormulaEvidenceBasis",
          "targetRecalibrationFormulaObservedValue",
          "targetRecalibrationFormulaThresholdValue",
          "targetRecalibrationFormulaDeltaValue",
          "targetRecalibrationFormulaUnit"
        ],
        "STOP_TARGET_RISK_GEOMETRY_RECALCULATION": [
          "riskGeometryFormulaEvidenceBasis",
          "riskGeometryFormulaObservedValue",
          "riskGeometryFormulaThresholdValue",
          "riskGeometryFormulaDeltaValue",
          "riskGeometryFormulaUnit"
        ],
        "RISK_GEOMETRY_NO_TRADE_OR_RECALIBRATION": [
          "riskGeometryFormulaEvidenceBasis",
          "riskGeometryFormulaObservedValue",
          "riskGeometryFormulaThresholdValue",
          "riskGeometryFormulaDeltaValue",
          "riskGeometryFormulaUnit"
        ],
        "BREAKOUT_PROOF_CONFIRMED_GENERATION": [
          "breakoutRetestProofFormulaEvidenceBasis",
          "breakoutRetestProofFormulaObservedValue",
          "breakoutRetestProofFormulaThresholdValue",
          "breakoutRetestProofFormulaDeltaValue",
          "breakoutRetestProofFormulaUnit"
        ],
        "STRUCTURE_PROOF_REQUIRED_NOT_RELAXATION": [
          "structurePolicyFormulaEvidenceBasis",
          "structurePolicyFormulaObservedValue",
          "structurePolicyFormulaThresholdValue",
          "structurePolicyFormulaDeltaValue",
          "structurePolicyFormulaUnit"
        ],
        "NO_ZERO_EXECUTABLE_TUNING_ACTION": []
      },
      "tunablePolicyFields": {
        "TARGET_RECALIBRATION": [
          "TARGET_RECALIBRATION_POLICY.maxRequiredTargetGapPct",
          "TARGET_RECALIBRATION_POLICY.maxExecutionFloorGapPct",
          "targetRecalibrationRequiredTargetPrice",
          "targetRecalibrationRequiredTargetSource",
          "targetRecalibrationRequiredTargetByExecutionFloorPrice",
          "targetRecalibrationRequiredTargetByExpectedReturnPrice",
          "targetRecalibrationExecutionFloorGapPct",
          "targetRecalibrationExecutionFloorViable",
          "targetRecalibrationViabilityVerdict",
          "targetRecalibrationExecutionFloorShortfallPct",
          "targetRecalibrationExpectedReturnShortfallPct",
          "targetRecalibrationRequiredTargetDominantReason"
        ],
        "STOP_TARGET_RISK_GEOMETRY_RECALCULATION": [
          "riskGeometryRequiredTargetPrice",
          "riskGeometryRequiredTargetSource",
          "riskGeometryTargetShortfallPct",
          "riskGeometryRrAtRequiredTargetAndRecalculatedStop",
          "riskGeometryTargetBufferAtRequiredTargetPct",
          "riskGeometryTargetRecalibrationProofReady",
          "riskGeometryRequiredStopValid",
          "riskGeometryRequiredStopDistanceValid",
          "riskGeometryRecalculatedStopRrOk",
          "riskGeometryTargetBufferOk",
          "riskGeometryRequiredTargetDominantReason",
          "riskGeometryStopDistancePolicyVerdict",
          "riskGeometryTargetShortfallPolicyVerdict"
        ],
        "RISK_GEOMETRY_NO_TRADE_OR_RECALIBRATION": [
          "riskGeometryRequiredTargetPrice",
          "riskGeometryRequiredTargetSource",
          "riskGeometryTargetShortfallPct",
          "riskGeometryTargetNoTradeConfirmed",
          "riskGeometryTargetRecalibrationGapPolicyPct",
          "riskGeometryTargetAboveCurrent",
          "riskGeometryRequiredTargetDominantReason",
          "riskGeometryTargetShortfallPolicyVerdict"
        ],
        "BREAKOUT_PROOF_CONFIRMED_GENERATION": [
          "BREAKOUT_RETEST_PROOF_POLICY.maxBarsSinceRetest",
          "BREAKOUT_RETEST_PROOF_POLICY.maxCurrentExtensionFromRetestPct",
          "BREAKOUT_RETEST_PROOF_POLICY.retestTolerancePct",
          "BREAKOUT_RETEST_PROOF_POLICY.maxReclaimUndercutExcessPct",
          "BREAKOUT_RETEST_PROOF_POLICY.maxContinuationExtensionPct",
          "BREAKOUT_RETEST_PROOF_POLICY.continuationMinRrMultiplier",
          "BREAKOUT_RETEST_PROOF_POLICY.continuationMinTargetBufferMultiplier",
          "breakoutRetestProofUndercutReclaimFound",
          "breakoutRetestProofConfirmed"
        ],
        "STRUCTURE_PROOF_REQUIRED_NOT_RELAXATION": [
          "CURRENT_ENTRY_STRUCTURE_POLICY.maxReviewDistancePct",
          "CURRENT_ENTRY_STRUCTURE_POLICY.supportBufferAtr",
          "CURRENT_ENTRY_STRUCTURE_POLICY.minStopAtr",
          "CURRENT_ENTRY_STRUCTURE_POLICY.maxStopAtr",
          "CURRENT_ENTRY_STRUCTURE_POLICY.maxPriceDriftPct",
          "currentEntryStructureVerdict",
          "currentEntryStructureStopSupportRelation",
          "currentEntryStructureSupportStopGapPct"
        ],
        "NO_ZERO_EXECUTABLE_TUNING_ACTION": []
      },
      "promotionSafetyRules": [
        "breakout_review_ready_never_promotes",
        "breakout_proof_confirmed_requires_promotion_flag",
        "target_already_reached_requires_recalibration_or_no_trade",
        "structure_reject_never_promotes_without_confirmed_structure",
        "sidecar_reprice_never_solves_stage6_target_geometry"
      ]
    }
  },
  "candidates": [
    {
      "symbol": "PASS1",
      "aiVerdict": "BUY",
      "finalDecision": "EXECUTABLE_NOW",
      "decisionReason": "executable_pullback",
      "executionActionableVerdict": true,
      "executionActionablePolicy": "BUY,STRONG_BUY,STRONGBUY",
      "executionActionableWaiver": false,
      "entryExecPrice": 100,
      "targetPrice": 130,
      "stopLoss": 90,
      "rrAtCurrentPrice": 2.4,
      "entryDistancePct": 2.5,
      "targetBufferFromCurrentPct": 22,
      "executionFeasibilityAtCurrent": "PASS",
      "executionFeasibilityAtCurrentVerdict": "CURRENT_ENTRY_FEASIBLE",
      "executionFeasibilityAtCurrentReason": null,
      "executionFeasibilityAtCurrentReasons": [],
      "executionFeasibilityAtCurrentRr": 2.4,
      "executionFeasibilityAtCurrentDistancePct": 2.5,
      "executionFeasibilityAtCurrentMinRr": 1.8,
      "executionFeasibilityAtCurrentMaxDistancePct": 6,